{
  "$schema": "https://json-schema.org/draft/2020-12/schema",
  "$id": "https://github.com/ippclub/Dora-Catalog/schema/resource-v1.schema.json",
  "title": "Dora SSR community resource",
  "type": "object",
  "additionalProperties": false,
  "required": [
    "schemaVersion",
    "id",
    "status",
    "title",
    "description",
    "categories",
    "license",
    "runnable",
    "entrypoints",
    "versions"
  ],
  "properties": {
    "$schema": {
      "type": "string"
    },
    "schemaVersion": {
      "const": 1
    },
    "id": {
      "type": "string",
      "pattern": "^[A-Za-z0-9._-]+$"
    },
    "status": {
      "enum": [
        "active",
        "deprecated",
        "unavailable",
        "blocked"
      ]
    },
    "title": {
      "$ref": "#/$defs/localizedText"
    },
    "description": {
      "$ref": "#/$defs/localizedText"
    },
    "categories": {
      "type": "array",
      "items": {
        "type": "string",
        "minLength": 1
      },
      "uniqueItems": true
    },
    "tags": {
      "type": "array",
      "items": {
        "type": "string",
        "pattern": "^[a-z0-9][a-z0-9-]*$"
      },
      "uniqueItems": true
    },
    "license": {
      "oneOf": [
        {
          "type": "object",
          "additionalProperties": false,
          "required": [
            "status"
          ],
          "properties": {
            "status": {
              "const": "pending"
            }
          }
        },
        {
          "type": "object",
          "additionalProperties": false,
          "required": [
            "status",
            "spdx"
          ],
          "properties": {
            "status": {
              "const": "confirmed"
            },
            "spdx": {
              "type": "string",
              "minLength": 1
            },
            "file": {
              "type": "string",
              "minLength": 1
            }
          }
        }
      ]
    },
    "runnable": {
      "type": "boolean"
    },
    "entrypoints": {
      "type": "array",
      "items": {
        "$ref": "#/$defs/entrypoint"
      }
    },
    "versions": {
      "type": "array",
      "minItems": 1,
      "items": {
        "$ref": "#/$defs/version"
      }
    },
    "playUrl": {
      "type": "string",
      "pattern": "^https://",
      "maxLength": 2048,
      "description": "Optional public browser game URL. Non-native games can appear in mobile feed and open this URL."
    }
  },
  "$defs": {
    "localizedText": {
      "type": "object",
      "additionalProperties": false,
      "required": [
        "zh-Hans",
        "en"
      ],
      "properties": {
        "zh-Hans": {
          "type": "string",
          "minLength": 1
        },
        "en": {
          "type": "string",
          "minLength": 1
        }
      }
    },
    "entrypoint": {
      "type": "object",
      "additionalProperties": false,
      "required": [
        "name",
        "path"
      ],
      "properties": {
        "name": {
          "type": "string",
          "minLength": 1
        },
        "path": {
          "type": "string",
          "minLength": 1,
          "description": "Dora module path used for launch metadata. It may omit the language extension, such as AI Fighter/init, and need not name an extensionless file."
        }
      }
    },
    "source": {
      "type": "object",
      "additionalProperties": false,
      "required": [
        "role",
        "url"
      ],
      "properties": {
        "role": {
          "enum": [
            "upstream",
            "mirror"
          ]
        },
        "url": {
          "type": "string",
          "pattern": "^https://"
        }
      }
    },
    "version": {
      "type": "object",
      "additionalProperties": false,
      "required": [
        "name",
        "publishedAt",
        "sources"
      ],
      "properties": {
        "name": {
          "type": "string",
          "minLength": 1
        },
        "tag": {
          "type": "string",
          "minLength": 1
        },
        "publishedAt": {
          "type": "string",
          "format": "date-time"
        },
        "sources": {
          "type": "array",
          "minItems": 1,
          "items": {
            "$ref": "#/$defs/source"
          }
        }
      }
    }
  }
}
