{
  "$schema": "../../schema/resource-v1.schema.json",
  "schemaVersion": 1,
  "id": "RtCt-3hgjwork_by_RtCt",
  "status": "active",
  "title": {
    "zh-Hans": "3hgj-by-RtCt",
    "en": "3hgj-by-RtCt"
  },
  "description": {
    "zh-Hans": "3小时游戏开发挑战参赛作品。",
    "en": "Entry for the 3-hour game jam."
  },
  "categories": [
    "Game",
    "3h-gamejam"
  ],
  "tags": [
    "minigame"
  ],
  "license": {
    "status": "pending"
  },
  "runnable": true,
  "entrypoints": [],
  "versions": [
    {
      "name": "latest",
      "publishedAt": "2026-05-12T00:54:51.000Z",
      "sources": [
        {
          "role": "upstream",
          "url": "https://gitcode.com/RtCt/3hgjwork_by_RtCt"
        }
      ]
    }
  ]
}
