{
  "$schema": "../../schema/resource-v1.schema.json",
  "schemaVersion": 1,
  "id": "DandelionTides-voice_of_the_starry_sky",
  "status": "active",
  "title": {
    "zh-Hans": "星空之声",
    "en": "星空之声"
  },
  "description": {
    "zh-Hans": "通过点按和滑动让声音基线产生不同波形，并以此推动小方块完成跑酷\nDandelionTides",
    "en": "通过点按和滑动让声音基线产生不同波形，并以此推动小方块完成跑酷\nDandelionTides"
  },
  "categories": [
    "Game",
    "2026 社区小游戏征集活动",
    "动作"
  ],
  "tags": [
    "minigame",
    "minigame-2026",
    "mobile-feed"
  ],
  "license": {
    "status": "pending"
  },
  "runnable": true,
  "entrypoints": [
    {
      "name": "星空之声",
      "path": "init"
    }
  ],
  "versions": [
    {
      "name": "latest",
      "publishedAt": "2026-10-04T15:19:52.330829Z",
      "sources": [
        {
          "role": "mirror",
          "url": "https://gitcode.com/dora-minigame-2026/DandelionTides-voice_of_the_starry_sky.git"
        }
      ]
    }
  ]
}
