{
  "$schema": "../../schema/resource-v1.schema.json",
  "schemaVersion": 1,
  "id": "DandelionTides-small_color_go",
  "status": "active",
  "title": {
    "zh-Hans": "三色围棋",
    "en": "三色围棋"
  },
  "description": {
    "zh-Hans": "基本规则与传统围棋大致相同，但引入了第三方棋子，即由2人对弈变为3人对弈。打劫、贴目、气的计算详见游戏开始页”规则“。\n作者为DandelionTides(https://github.com/DandelionTides)",
    "en": "基本规则与传统围棋大致相同，但引入了第三方棋子，即由2人对弈变为3人对弈。打劫、贴目、气的计算详见游戏开始页”规则“。\n作者为DandelionTides(https://github.com/DandelionTides)"
  },
  "categories": [
    "Game",
    "2026 社区小游戏征集活动",
    "策略"
  ],
  "tags": [
    "minigame",
    "minigame-2026",
    "mobile-feed"
  ],
  "license": {
    "status": "pending"
  },
  "runnable": true,
  "entrypoints": [
    {
      "name": "三色围棋",
      "path": "init"
    }
  ],
  "versions": [
    {
      "name": "latest",
      "publishedAt": "2026-09-26T10:01:29.407422Z",
      "sources": [
        {
          "role": "mirror",
          "url": "https://gitcode.com/dora-minigame-2026/DandelionTides-small_color_go.git"
        }
      ]
    }
  ],
  "playUrl": "https://g17.opensourcegame.games/index.html"
}
